[
  {
    "fixture_id": "synthetic_investment_tail_01_01_r01",
    "scenario_focus": "investment",
    "noisy_user_observations": [
      "Composite synthetic investment planning fixture. A rare late witness is decisive but appears after more salient background details.",
      "No raw production history is used; this fixture preserves only an abstract tail_witness stress mechanism.",
      "Noisy self-report contains recent excitement, older constraints, and one low-frequency witness: household_boundary_tail_tail_r01.",
      "Replicate 1 varies the witness and follow-up labels while preserving the same oracle stress surface."
    ],
    "confirmed_hard_constraints": [
      "protected_cash_must_remain_outside_high_volatility_position",
      "household_buffer_must_stay_available"
    ],
    "mutable_state_facts": [
      "risk_position_size_can_change",
      "rebalance_timing_can_change",
      "investment_tail_local_priority_can_change"
    ],
    "required_dimensions": [
      "finance",
      "relationship_family"
    ],
    "required_detail_slots": [
      "protected_cash",
      "household_cost",
      "late_tail_witness",
      "investment_tail_r01_slot"
    ],
    "required_witnesses": [
      "protected_cash_anchor",
      "position_size_anchor",
      "investment_tail_r01_anchor"
    ],
    "tail_witnesses": [
      "household_boundary_tail_tail_r01"
    ],
    "consequence_debt": [
      "household_liquidity_followup",
      "investment_tail_r01_followup"
    ],
    "runtime_repair_guards": [],
    "oracle_feasible_set_empty": false,
    "expected_repair_or_abstain": false,
    "expected_valid_commitment_fields": [
      "decision",
      "risk_boundary",
      "next_check"
    ],
    "failure_surface": [
      "witness_drop",
      "consequence_debt"
    ]
  },
  {
    "fixture_id": "synthetic_investment_tail_01_01_r02",
    "scenario_focus": "investment",
    "noisy_user_observations": [
      "Composite synthetic investment planning fixture. A rare late witness is decisive but appears after more salient background details.",
      "No raw production history is used; this fixture preserves only an abstract tail_witness stress mechanism.",
      "Noisy self-report contains recent excitement, older constraints, and one low-frequency witness: household_boundary_tail_tail_r02.",
      "Replicate 2 varies the witness and follow-up labels while preserving the same oracle stress surface."
    ],
    "confirmed_hard_constraints": [
      "protected_cash_must_remain_outside_high_volatility_position",
      "household_buffer_must_stay_available"
    ],
    "mutable_state_facts": [
      "risk_position_size_can_change",
      "rebalance_timing_can_change",
      "investment_tail_local_priority_can_change"
    ],
    "required_dimensions": [
      "finance",
      "relationship_family"
    ],
    "required_detail_slots": [
      "protected_cash",
      "household_cost",
      "late_tail_witness",
      "investment_tail_r02_slot"
    ],
    "required_witnesses": [
      "protected_cash_anchor",
      "position_size_anchor",
      "investment_tail_r02_anchor"
    ],
    "tail_witnesses": [
      "household_boundary_tail_tail_r02"
    ],
    "consequence_debt": [
      "household_liquidity_followup",
      "investment_tail_r02_followup"
    ],
    "runtime_repair_guards": [],
    "oracle_feasible_set_empty": false,
    "expected_repair_or_abstain": false,
    "expected_valid_commitment_fields": [
      "decision",
      "risk_boundary",
      "next_check"
    ],
    "failure_surface": [
      "witness_drop",
      "consequence_debt"
    ]
  },
  {
    "fixture_id": "synthetic_investment_tail_01_01_r03",
    "scenario_focus": "investment",
    "noisy_user_observations": [
      "Composite synthetic investment planning fixture. A rare late witness is decisive but appears after more salient background details.",
      "No raw production history is used; this fixture preserves only an abstract tail_witness stress mechanism.",
      "Noisy self-report contains recent excitement, older constraints, and one low-frequency witness: household_boundary_tail_tail_r03.",
      "Replicate 3 varies the witness and follow-up labels while preserving the same oracle stress surface."
    ],
    "confirmed_hard_constraints": [
      "protected_cash_must_remain_outside_high_volatility_position",
      "household_buffer_must_stay_available"
    ],
    "mutable_state_facts": [
      "risk_position_size_can_change",
      "rebalance_timing_can_change",
      "investment_tail_local_priority_can_change"
    ],
    "required_dimensions": [
      "finance",
      "relationship_family"
    ],
    "required_detail_slots": [
      "protected_cash",
      "household_cost",
      "late_tail_witness",
      "investment_tail_r03_slot"
    ],
    "required_witnesses": [
      "protected_cash_anchor",
      "position_size_anchor",
      "investment_tail_r03_anchor"
    ],
    "tail_witnesses": [
      "household_boundary_tail_tail_r03"
    ],
    "consequence_debt": [
      "household_liquidity_followup",
      "investment_tail_r03_followup"
    ],
    "runtime_repair_guards": [],
    "oracle_feasible_set_empty": false,
    "expected_repair_or_abstain": false,
    "expected_valid_commitment_fields": [
      "decision",
      "risk_boundary",
      "next_check"
    ],
    "failure_surface": [
      "witness_drop",
      "consequence_debt"
    ]
  },
  {
    "fixture_id": "synthetic_investment_infeasible_01_02_r01",
    "scenario_focus": "investment",
    "noisy_user_observations": [
      "Composite synthetic investment planning fixture. Two explicitly confirmed requirements cannot both be satisfied by any available commitment.",
      "No raw production history is used; this fixture preserves only an abstract no_feasible stress mechanism.",
      "Noisy self-report contains recent excitement, older constraints, and one low-frequency witness: household_boundary_tail_infeasible_r01.",
      "Replicate 1 varies the witness and follow-up labels while preserving the same oracle stress surface."
    ],
    "confirmed_hard_constraints": [
      "protected_cash_must_remain_outside_high_volatility_position",
      "household_buffer_must_stay_available",
      "investment_infeasible_must_do_action_now",
      "investment_infeasible_must_not_do_action_now"
    ],
    "mutable_state_facts": [
      "risk_position_size_can_change",
      "rebalance_timing_can_change",
      "investment_infeasible_local_priority_can_change"
    ],
    "required_dimensions": [
      "finance",
      "relationship_family"
    ],
    "required_detail_slots": [
      "protected_cash",
      "household_cost",
      "late_tail_witness",
      "investment_infeasible_r01_slot"
    ],
    "required_witnesses": [
      "protected_cash_anchor",
      "position_size_anchor",
      "investment_infeasible_r01_anchor"
    ],
    "tail_witnesses": [
      "household_boundary_tail_infeasible_r01"
    ],
    "consequence_debt": [
      "household_liquidity_followup",
      "investment_infeasible_r01_followup"
    ],
    "runtime_repair_guards": [
      "contract_conflict"
    ],
    "oracle_feasible_set_empty": true,
    "expected_repair_or_abstain": true,
    "expected_valid_commitment_fields": [
      "abstain_reason",
      "needed_clarification"
    ],
    "failure_surface": [
      "no_feasible_candidate",
      "hidden_exception"
    ]
  },
  {
    "fixture_id": "synthetic_investment_infeasible_01_02_r02",
    "scenario_focus": "investment",
    "noisy_user_observations": [
      "Composite synthetic investment planning fixture. Two explicitly confirmed requirements cannot both be satisfied by any available commitment.",
      "No raw production history is used; this fixture preserves only an abstract no_feasible stress mechanism.",
      "Noisy self-report contains recent excitement, older constraints, and one low-frequency witness: household_boundary_tail_infeasible_r02.",
      "Replicate 2 varies the witness and follow-up labels while preserving the same oracle stress surface."
    ],
    "confirmed_hard_constraints": [
      "protected_cash_must_remain_outside_high_volatility_position",
      "household_buffer_must_stay_available",
      "investment_infeasible_must_do_action_now",
      "investment_infeasible_must_not_do_action_now"
    ],
    "mutable_state_facts": [
      "risk_position_size_can_change",
      "rebalance_timing_can_change",
      "investment_infeasible_local_priority_can_change"
    ],
    "required_dimensions": [
      "finance",
      "relationship_family"
    ],
    "required_detail_slots": [
      "protected_cash",
      "household_cost",
      "late_tail_witness",
      "investment_infeasible_r02_slot"
    ],
    "required_witnesses": [
      "protected_cash_anchor",
      "position_size_anchor",
      "investment_infeasible_r02_anchor"
    ],
    "tail_witnesses": [
      "household_boundary_tail_infeasible_r02"
    ],
    "consequence_debt": [
      "household_liquidity_followup",
      "investment_infeasible_r02_followup"
    ],
    "runtime_repair_guards": [
      "contract_conflict"
    ],
    "oracle_feasible_set_empty": true,
    "expected_repair_or_abstain": true,
    "expected_valid_commitment_fields": [
      "abstain_reason",
      "needed_clarification"
    ],
    "failure_surface": [
      "no_feasible_candidate",
      "hidden_exception"
    ]
  },
  {
    "fixture_id": "synthetic_investment_infeasible_01_02_r03",
    "scenario_focus": "investment",
    "noisy_user_observations": [
      "Composite synthetic investment planning fixture. Two explicitly confirmed requirements cannot both be satisfied by any available commitment.",
      "No raw production history is used; this fixture preserves only an abstract no_feasible stress mechanism.",
      "Noisy self-report contains recent excitement, older constraints, and one low-frequency witness: household_boundary_tail_infeasible_r03.",